{
  "created_at": "2026-09-05T17:08:12.025118Z",
  "created_by": "human:quanpersie2001",
  "from": {
    "content_hash": null,
    "id": "LRN-001",
    "kind": "learning",
    "revision": null
  },
  "id": "derived-from--LRN-001--work--TK-001",
  "revision": 1,
  "schema_version": 1,
  "to": {
    "content_hash": null,
    "id": "TK-001",
    "kind": "work",
    "revision": 15
  },
  "type": "derived_from"
}
